{
  "$schema": "https://json-schema.org/draft/2020-12/schema",
  "$id": "https://design-consultant.local/schemas/tokens.schema.json",
  "title": "Design Consultant Token Source",
  "description": "The only editable source for generated CSS and TypeScript design tokens.",
  "type": "object",
  "required": [
    "$schema",
    "meta",
    "taxonomy",
    "themes",
    "tokens"
  ],
  "properties": {
    "$schema": {
      "const": "./tokens.schema.json"
    },
    "meta": {
      "type": "object",
      "required": [
        "name",
        "version",
        "sourceOfTruth",
        "colorMode"
      ],
      "properties": {
        "name": {
          "type": "string",
          "minLength": 1
        },
        "version": {
          "type": "string",
          "pattern": "^[0-9]+\\.[0-9]+\\.[0-9]+$"
        },
        "sourceOfTruth": {
          "const": "tokens.json"
        },
        "colorMode": {
          "const": "light-dark"
        }
      },
      "additionalProperties": true
    },
    "taxonomy": {
      "type": "object",
      "required": [
        "base",
        "semantic",
        "component",
        "data-viz"
      ],
      "properties": {
        "base": {
          "type": "array",
          "minItems": 1,
          "uniqueItems": true,
          "items": {
            "type": "string",
            "minLength": 1
          }
        },
        "semantic": {
          "type": "array",
          "minItems": 1,
          "uniqueItems": true,
          "items": {
            "type": "string",
            "minLength": 1
          }
        },
        "component": {
          "type": "array",
          "minItems": 1,
          "uniqueItems": true,
          "items": {
            "type": "string",
            "minLength": 1
          }
        },
        "data-viz": {
          "type": "array",
          "minItems": 1,
          "uniqueItems": true,
          "items": {
            "type": "string",
            "minLength": 1
          }
        }
      },
      "additionalProperties": false
    },
    "themes": {
      "type": "object",
      "required": [
        "default",
        "variants"
      ],
      "properties": {
        "default": {
          "$ref": "#/$defs/themeIdentity"
        },
        "variants": {
          "type": "object",
          "additionalProperties": {
            "$ref": "#/$defs/themeVariant"
          }
        }
      },
      "additionalProperties": false
    },
    "tokens": {
      "type": "object",
      "minProperties": 1,
      "additionalProperties": {
        "$ref": "#/$defs/tokenNode"
      }
    },
    "principles": {},
    "components": {},
    "enforcement": {}
  },
  "additionalProperties": false,
  "$defs": {
    "tokenLeaf": {
      "type": "object",
      "required": [
        "value",
        "cssVariable"
      ],
      "properties": {
        "value": {
          "type": "string"
        },
        "cssVariable": {
          "type": "string",
          "pattern": "^--[a-z0-9-]+$"
        },
        "role": {
          "type": "string"
        }
      },
      "additionalProperties": true
    },
    "tokenNode": {
      "oneOf": [
        {
          "$ref": "#/$defs/tokenLeaf"
        },
        {
          "type": "object",
          "minProperties": 1,
          "properties": {
            "description": {
              "type": "string"
            }
          },
          "additionalProperties": {
            "$ref": "#/$defs/tokenNode"
          }
        }
      ]
    },
    "themeIdentity": {
      "type": "object",
      "required": [
        "palette",
        "mode"
      ],
      "properties": {
        "palette": {
          "type": "string",
          "minLength": 1
        },
        "mode": {
          "enum": [
            "light",
            "dark"
          ]
        }
      },
      "additionalProperties": false
    },
    "themeVariant": {
      "type": "object",
      "required": [
        "selector",
        "palette",
        "mode",
        "tokens"
      ],
      "properties": {
        "selector": {
          "type": "string",
          "minLength": 1
        },
        "palette": {
          "type": "string",
          "minLength": 1
        },
        "mode": {
          "enum": [
            "light",
            "dark"
          ]
        },
        "tokens": {
          "type": "object",
          "additionalProperties": {
            "type": "string"
          }
        }
      },
      "additionalProperties": false
    }
  }
}
