{
  "$schema": "./tokens.schema.json",
  "meta": {
    "name": "[project] design tokens",
    "version": "0.7.0",
    "status": "draft",
    "language": "zh-CN",
    "colorMode": "light-dark",
    "sourceOfTruth": "tokens.json",
    "visualDirection": "editorial-utility",
    "palette": "harbor-blue",
    "paletteOptions": ["harbor-blue", "coral-office"]
  },
  "taxonomy": {
    "base": ["color.neutral", "color.paletteReference", "typography", "space", "radius", "motion"],
    "semantic": ["color"],
    "component": ["control", "shadow", "brandAttribution"],
    "data-viz": ["visualization"]
  },
  "principles": [
    "先服务任务完成，再表达品牌",
    "用编辑型信息层级提升可读性，不把产品界面做成杂志封面",
    "token 先行，组件复用，页面不临时发明样式",
    "图表与通用组件共享表面、文字、中性色阶和动效节奏"
  ],
  "themes": {
    "default": {
      "palette": "harbor-blue",
      "mode": "light"
    },
    "variants": {
      "harbor-dark": {
        "selector": ":root[data-theme=\"dark\"]",
        "palette": "harbor-blue",
        "mode": "dark",
        "tokens": {
          "color.bg": "#08111F",
          "color.surface": "#0D1C2B",
          "color.surfaceMuted": "#12283D",
          "color.surfaceSubtle": "#0A1725",
          "color.surfaceHover": "#142A40",
          "color.surfaceTableHead": "#12283D",
          "color.surfaceRaised": "#17344F",
          "color.surfaceInverse": "#050B12",
          "color.surfaceInverseMuted": "#132B45",
          "color.text": "#EDF6FF",
          "color.textMuted": "#B6C5D4",
          "color.textSoft": "#9AAFC2",
          "color.textInverse": "#FFFFFF",
          "color.border": "#294158",
          "color.borderStrong": "#48657F",
          "color.primary": "#0F6CDD",
          "color.primaryHover": "#0958D9",
          "color.primarySoft": "#113B66",
          "color.secondary": "#5CD6D6",
          "color.secondarySoft": "#123C44",
          "color.accentPlum": "#B79CFF",
          "color.accentOchre": "#F0B44D",
          "color.accentRose": "#FF86C8",
          "color.success": "#6CCB5F",
          "color.successSoft": "#163F2A",
          "color.warning": "#F0B44D",
          "color.warningSoft": "#463410",
          "color.danger": "#FF7A80",
          "color.dangerSoft": "#4A2027",
          "color.info": "#69B1FF",
          "color.infoSoft": "#133B66",
          "color.disabledBackground": "#203448",
          "color.disabledText": "#8397A9",
          "shadow.soft": "0 1px 2px rgb(0 0 0 / 24%), 0 10px 26px rgb(0 0 0 / 28%)",
          "shadow.card": "0 2px 10px rgb(0 0 0 / 18%), 0 12px 28px rgb(0 0 0 / 16%)",
          "shadow.popover": "0 10px 28px rgb(0 0 0 / 38%), 0 2px 8px rgb(0 0 0 / 26%)",
          "shadow.dialog": "0 18px 48px rgb(0 0 0 / 48%), 0 4px 14px rgb(0 0 0 / 32%)",
          "shadow.overlay": "0 22px 56px rgb(0 0 0 / 48%)",
          "shadow.focusRing": "0 0 0 3px rgb(105 177 255 / 32%)",
          "brandAttribution.accent": "#818CF8",
          "visualization.semantic.accentStrong": "#D4E9FF",
          "visualization.semantic.accent": "#69B1FF",
          "visualization.semantic.accentMid": "#438CD5",
          "visualization.semantic.accentSoft": "#2A6299",
          "visualization.semantic.accentSubtle": "#1C4269",
          "visualization.semantic.accentArea": "#14334F",
          "visualization.semantic.accentOnDarkStrong": "#D4E9FF",
          "visualization.semantic.accentOnDark": "#69B1FF",
          "visualization.semantic.accentOnDarkMid": "#438CD5",
          "visualization.semantic.accentOnDarkSoft": "#2A6299",
          "visualization.semantic.accentOnDarkSubtle": "#1C4269",
          "visualization.semantic.accentOnDarkArea": "#14334F"
        }
      },
      "coral-light": {
        "selector": ":root[data-palette=\"coral\"]",
        "palette": "coral-office",
        "mode": "light",
        "tokens": {
          "color.bg": "#F7F8F7",
          "color.surface": "#FFFFFF",
          "color.surfaceMuted": "#EFF2F0",
          "color.surfaceSubtle": "#FAFBFA",
          "color.surfaceHover": "#FFF8F6",
          "color.surfaceTableHead": "#EFF2F0",
          "color.surfaceRaised": "#FFFFFF",
          "color.surfaceInverse": "#25292A",
          "color.surfaceInverseMuted": "#353B3F",
          "color.text": "#24272A",
          "color.textMuted": "#596268",
          "color.textSoft": "#687176",
          "color.textInverse": "#FFFFFF",
          "color.border": "#D9DEDB",
          "color.borderStrong": "#AEB7B2",
          "color.primary": "#C24135",
          "color.primaryHover": "#A9352C",
          "color.primarySoft": "#FBE8E4",
          "color.secondary": "#4F6F58",
          "color.secondarySoft": "#E8F0EA",
          "color.accentPlum": "#74506B",
          "color.accentOchre": "#8A5B00",
          "color.accentRose": "#B42373",
          "color.success": "#237804",
          "color.successSoft": "#F6FFED",
          "color.warning": "#8A5B00",
          "color.warningSoft": "#FFF7DF",
          "color.danger": "#C9363E",
          "color.dangerSoft": "#FFF0F1",
          "color.info": "#74506B",
          "color.infoSoft": "#F4EDF2",
          "color.disabledBackground": "#E1E5E2",
          "color.disabledText": "#7F8983",
          "shadow.soft": "0 1px 2px rgb(36 39 42 / 5%), 0 8px 22px rgb(36 39 42 / 8%)",
          "shadow.card": "0 2px 10px rgb(36 39 42 / 4%), 0 12px 28px rgb(36 39 42 / 5%)",
          "shadow.popover": "0 10px 28px rgb(36 39 42 / 12%), 0 2px 8px rgb(36 39 42 / 6%)",
          "shadow.dialog": "0 18px 48px rgb(36 39 42 / 19%), 0 4px 14px rgb(36 39 42 / 9%)",
          "shadow.overlay": "0 18px 48px rgb(36 39 42 / 18%)",
          "shadow.focusRing": "0 0 0 3px rgb(194 65 53 / 24%)",
          "visualization.semantic.accentStrong": "#9E3027",
          "visualization.semantic.accent": "#C24135",
          "visualization.semantic.accentMid": "#D8756A",
          "visualization.semantic.accentSoft": "#EAB2AC",
          "visualization.semantic.accentSubtle": "#F5D9D5",
          "visualization.semantic.accentArea": "#FAEAE7",
          "visualization.semantic.accentOnDarkStrong": "#FFD6CF",
          "visualization.semantic.accentOnDark": "#FF9B8A",
          "visualization.semantic.accentOnDarkMid": "#D87365",
          "visualization.semantic.accentOnDarkSoft": "#A94D43",
          "visualization.semantic.accentOnDarkSubtle": "#71342E",
          "visualization.semantic.accentOnDarkArea": "#4A2723"
        }
      },
      "coral-dark": {
        "selector": ":root[data-palette=\"coral\"][data-theme=\"dark\"]",
        "palette": "coral-office",
        "mode": "dark",
        "tokens": {
          "color.bg": "#151719",
          "color.surface": "#1D2023",
          "color.surfaceMuted": "#25292D",
          "color.surfaceSubtle": "#191C1F",
          "color.surfaceHover": "#2B3034",
          "color.surfaceTableHead": "#25292D",
          "color.surfaceRaised": "#2B3034",
          "color.surfaceInverse": "#0B0D0F",
          "color.surfaceInverseMuted": "#25292D",
          "color.text": "#F5F6F6",
          "color.textMuted": "#C3C8CC",
          "color.textSoft": "#A8B0B6",
          "color.textInverse": "#FFFFFF",
          "color.border": "#3B4248",
          "color.borderStrong": "#59636B",
          "color.primary": "#C24135",
          "color.primaryHover": "#A9352C",
          "color.primarySoft": "#44231F",
          "color.secondary": "#9FC4A7",
          "color.secondarySoft": "#293A2E",
          "color.accentPlum": "#D3A9C8",
          "color.accentOchre": "#F2BA57",
          "color.accentRose": "#FF98CF",
          "color.success": "#70D267",
          "color.successSoft": "#183E2B",
          "color.warning": "#F2BA57",
          "color.warningSoft": "#493716",
          "color.danger": "#FF8587",
          "color.dangerSoft": "#4B2328",
          "color.info": "#D3A9C8",
          "color.infoSoft": "#3E2F3B",
          "color.disabledBackground": "#30363A",
          "color.disabledText": "#8C969D",
          "shadow.soft": "0 1px 2px rgb(0 0 0 / 26%), 0 10px 26px rgb(0 0 0 / 30%)",
          "shadow.card": "0 2px 10px rgb(0 0 0 / 20%), 0 12px 28px rgb(0 0 0 / 18%)",
          "shadow.popover": "0 10px 28px rgb(0 0 0 / 40%), 0 2px 8px rgb(0 0 0 / 28%)",
          "shadow.dialog": "0 18px 48px rgb(0 0 0 / 50%), 0 4px 14px rgb(0 0 0 / 34%)",
          "shadow.overlay": "0 22px 56px rgb(0 0 0 / 52%)",
          "shadow.focusRing": "0 0 0 3px rgb(255 155 138 / 30%)",
          "brandAttribution.accent": "#818CF8",
          "visualization.semantic.accentStrong": "#FFD6CF",
          "visualization.semantic.accent": "#FF9B8A",
          "visualization.semantic.accentMid": "#D87365",
          "visualization.semantic.accentSoft": "#A94D43",
          "visualization.semantic.accentSubtle": "#71342E",
          "visualization.semantic.accentArea": "#4A2723",
          "visualization.semantic.accentOnDarkStrong": "#FFD6CF",
          "visualization.semantic.accentOnDark": "#FF9B8A",
          "visualization.semantic.accentOnDarkMid": "#D87365",
          "visualization.semantic.accentOnDarkSoft": "#A94D43",
          "visualization.semantic.accentOnDarkSubtle": "#71342E",
          "visualization.semantic.accentOnDarkArea": "#4A2723"
        }
      }
    }
  },
  "tokens": {
    "color": {
      "bg": { "value": "#F3F6F9", "cssVariable": "--bg", "role": "cool neutral application canvas" },
      "surface": { "value": "#FFFFFF", "cssVariable": "--surface", "role": "primary content and navigation surface" },
      "surfaceMuted": { "value": "#EDF2F7", "cssVariable": "--surface-muted", "role": "secondary content surface" },
      "surfaceSubtle": { "value": "#F8FAFC", "cssVariable": "--surface-subtle", "role": "quiet utility and component preview surface" },
      "surfaceHover": { "value": "#F5F9FD", "cssVariable": "--surface-hover", "role": "neutral hover surface with a restrained palette tint" },
      "surfaceTableHead": { "value": "#EDF2F7", "cssVariable": "--surface-table-head", "role": "data table header and sticky structural surface" },